{
  "schemaVersion": "1.0.0",
  "runId": "run_abc123456789",
  "projectId": "prj_abc123456789",
  "state": "PROPOSAL_PERSISTED",
  "stateHistory": [
    { "state": "ASSESSING", "at": "2026-07-23T01:00:00.000Z" },
    { "state": "PROPOSAL_PERSISTED", "at": "2026-07-23T02:00:00.000Z" }
  ],
  "attempts": 1,
  "lock": null,
  "error": null,
  "resumableAction": "approve",
  "hashes": { "assessment": "fedcba0987654321" },
  "updatedAt": "2026-07-23T02:00:00.000Z"
}
